{
  "specVersion": "0.2.0",
  "proposedUse": {
    "id": "USE-HH-MM-001",
    "version": "2.0",
    "title": "Train a Moss & Moon lip-sync model from Harbor Heroes recordings",
    "plainLanguageQuestion": "Can I use voice recordings from a completed client show to train a lip-sync model for our own IP show?",
    "requestedBy": "PERSON-REQUESTER-01",
    "requestedAt": "2026-09-16T02:00:00Z",
    "businessOwnerId": "ROLE-CREATIVE-TECH-DIRECTOR",
    "source": {
      "inventoryStatus": "verified",
      "models": [
        {
          "modelId": "MODEL-MOUTHSHAPE-RESEARCH-2",
          "version": "2.0",
          "useRoles": [
            "fine_tune_base"
          ]
        }
      ],
      "collectionId": "COLLECTION-HH-VOICE-204",
      "collectionVersion": "3.0",
      "manifestReference": "HH-204 manifest v3",
      "materials": [
        {
          "materialId": "MATERIAL-HH-204-AVA",
          "version": "1.0",
          "category": "voice_or_audio",
          "productionId": "PRODUCTION-HARBOR-HEROES",
          "containsPersonalData": true,
          "containsSensitiveData": null
        },
        {
          "materialId": "MATERIAL-HH-204-MATEO",
          "version": "1.0",
          "category": "voice_or_audio",
          "productionId": "PRODUCTION-HARBOR-HEROES",
          "containsPersonalData": true,
          "containsSensitiveData": null
        }
      ],
      "sourceProductionIds": [
        "PRODUCTION-HARBOR-HEROES"
      ],
      "lineageComplete": true,
      "notes": "Twelve dialogue takes from two represented performers plus the verified MouthShape Research 2.0 pre-trained model used as the fine-tuning base."
    },
    "contractsAndContributors": {
      "contributorInventoryStatus": "verified",
      "representedPersonIds": [
        "PERSON-AVA-LIN",
        "PERSON-MATEO-RUIZ"
      ],
      "representedCohortIds": [],
      "agreementIds": [
        "AGREEMENT-HH-PRODUCTION",
        "AGREEMENT-MOTIONMAP-MODEL-LICENCE"
      ],
      "individualAgreementIds": [
        "AGREEMENT-AVA-12",
        "AGREEMENT-MATEO-08"
      ],
      "collectiveInstrumentIds": [
        "COLLECTIVE-AVPC-24",
        "COLLECTIVE-USV-23"
      ],
      "consentRecordIds": [],
      "privacyBasisIds": [],
      "applicableJurisdictions": [
        "AU-NSW",
        "US-CA"
      ],
      "unknowns": [
        "Client permission for cross-production training",
        "Purpose-specific performer permissions",
        "Authorised interpretation of mouth-shape model under Mateo's rider"
      ]
    },
    "operation": {
      "types": [
        "fine_tune"
      ],
      "description": "Train a model that predicts animation mouth shapes from dialogue audio.",
      "humanRole": "assistive",
      "persistence": [
        "model_weights",
        "logs"
      ],
      "expectedDerivatives": [
        {
          "category": "lip_sync_model",
          "retained": true,
          "retention": "unknown",
          "destinationReference": "Moss & Moon research model registry"
        }
      ],
      "learnedCapability": "Predict viseme and mouth-shape timing. The technical team must confirm whether performance characteristics can be reproduced or memorised.",
      "technicalOwnerId": "ROLE-ML-LEAD"
    },
    "purpose": {
      "description": "Use the retained lip-sync capability to assist animation on Northstar-owned Moss & Moon.",
      "destinationProductionIds": [
        "PRODUCTION-MOSS-AND-MOON"
      ],
      "beneficiaryOrganisationIds": [
        "ORG-NORTHSTAR-ANIMATION"
      ],
      "audiences": [
        "production_team",
        "system_only"
      ],
      "affectedGroups": [
        "Voice performers",
        "Animation team"
      ],
      "commercialUse": true,
      "impactIfWrong": "high",
      "productionRelationships": [
        "different_production"
      ],
      "businessPurposes": [
        "research_or_evaluation",
        "production_work"
      ],
      "reuseIntent": "production_only",
      "distribution": [
        "internal"
      ]
    },
    "environment": {
      "status": "verified",
      "toolEnvironmentId": "ENV-MOTIONMAP-AU-LAB",
      "product": "MotionMap Lab",
      "provider": "Fictional Motion Systems",
      "modelIds": [
        "MODEL-MOUTHSHAPE-RESEARCH-2"
      ],
      "tenantOrAccountId": "northstar-au-research",
      "deploymentType": "private_tenant",
      "providerTraining": "disabled_by_contract",
      "providerHumanAccess": "support_only",
      "processingRegions": [
        "AU"
      ],
      "storageRegions": [
        "AU"
      ],
      "supportAccessRegions": [
        "AU"
      ],
      "accessGroupIds": [
        "GROUP-MM-RESEARCH-AU"
      ],
      "subprocessorIds": [],
      "connectedServiceIds": [],
      "retention": {
        "source": 30,
        "output": 30,
        "logs": 90,
        "backups": 30
      },
      "deletionSupported": true,
      "securityApprovalId": "APPROVAL-MOTIONMAP-SECURITY"
    },
    "requestedControls": [
      {
        "control": "Exclude all voice and likeness synthesis features",
        "ownerId": "ROLE-ML-LEAD",
        "dueBeforeProcessing": true
      }
    ]
  },
  "decision": {
    "id": "DECISION-HH-MM-001",
    "version": "2.0",
    "proposedUseId": "USE-HH-MM-001",
    "proposedUseVersion": "2.0",
    "outcome": "hold_approval_required",
    "answer": "Hold the training. Business and Legal Affairs must resolve the client and performer permissions before the recordings enter the training environment.",
    "scopeSummary": "Twelve Harbor Heroes dialogue takes from Ava Lin and Mateo Ruiz, used to train and retain a mouth-shape prediction model for Moss & Moon in MotionMap Lab's Australian private tenant.",
    "gateResults": [
      {
        "gate": "inventory",
        "result": "satisfied",
        "explanation": "The exact recordings, both represented performers and the pre-trained model used for fine-tuning are identified and versioned.",
        "ruleIds": [
          "RULE-EXACT-INVENTORY"
        ],
        "evidenceIds": [
          "COLLECTION-HH-VOICE-204",
          "MODEL-MOUTHSHAPE-RESEARCH-2"
        ],
        "responsibleRole": "Production data steward",
        "basis": [
          {
            "kind": "inventory_verification",
            "evidenceIds": [
              "COLLECTION-HH-VOICE-204",
              "MODEL-MOUTHSHAPE-RESEARCH-2"
            ],
            "verifiedBy": "ROLE-DATA-STEWARD",
            "scopeReferences": [
              "USE-HH-MM-001"
            ],
            "explanation": "The exact recordings, both represented performers and the pre-trained model used for fine-tuning are identified and versioned."
          }
        ]
      },
      {
        "gate": "source_authority",
        "result": "approval_required",
        "explanation": "The base-model licence permits the declared fine-tuning and internal retained weights, but no verified client permission covers training from the recordings for a different production.",
        "ruleIds": [
          "RULE-HH-CROSS-PRODUCTION-APPROVAL"
        ],
        "evidenceIds": [
          "AGREEMENT-HH-PRODUCTION",
          "AGREEMENT-MOTIONMAP-MODEL-LICENCE",
          "MODEL-MOUTHSHAPE-RESEARCH-2"
        ],
        "responsibleRole": "Business and Legal Affairs",
        "basis": []
      },
      {
        "gate": "contributor_rights",
        "result": "approval_required",
        "explanation": "Ava requires purpose-specific agreement and Mateo's restriction requires an authorised technical and legal interpretation. Collective terms apply separately.",
        "ruleIds": [
          "RULE-AVA-AI-CONSENT",
          "RULE-MATEO-SYNTHETIC-PERFORMANCE"
        ],
        "evidenceIds": [
          "AGREEMENT-AVA-12",
          "AGREEMENT-MATEO-08",
          "COLLECTIVE-AVPC-24",
          "COLLECTIVE-USV-23"
        ],
        "responsibleRole": "Business and Legal Affairs",
        "basis": []
      },
      {
        "gate": "privacy_and_people_impact",
        "result": "approval_required",
        "explanation": "The secondary use of identifiable voice recordings requires a verified purpose-specific privacy basis and contributor process.",
        "ruleIds": [
          "RULE-PERSONAL-DATA-SECONDARY-USE"
        ],
        "evidenceIds": [
          "COLLECTION-HH-VOICE-204"
        ],
        "responsibleRole": "Privacy owner",
        "basis": []
      },
      {
        "gate": "operation",
        "result": "missing_information",
        "explanation": "The learned capability, model retention duration and deletion plan require technical verification before approval can be assessed.",
        "ruleIds": [
          "RULE-PERSISTENT-MODEL-DESCRIPTION"
        ],
        "evidenceIds": [
          "ENV-MOTIONMAP-AU-LAB"
        ],
        "responsibleRole": "ML lead",
        "basis": []
      },
      {
        "gate": "purpose_and_destination",
        "result": "approval_required",
        "explanation": "The destination is company-owned IP and differs from the client production that created the recordings.",
        "ruleIds": [
          "RULE-HH-CROSS-PRODUCTION-APPROVAL"
        ],
        "evidenceIds": [
          "AGREEMENT-HH-PRODUCTION",
          "PRODUCTION-MOSS-AND-MOON"
        ],
        "responsibleRole": "Business and Legal Affairs",
        "basis": []
      },
      {
        "gate": "environment",
        "result": "satisfied",
        "explanation": "The current Australian private tenant configuration is technically approved; source rights and final model retention remain separate unresolved gates.",
        "ruleIds": [
          "RULE-MOTIONMAP-AU-ENVIRONMENT"
        ],
        "evidenceIds": [
          "ENV-MOTIONMAP-AU-LAB",
          "APPROVAL-MOTIONMAP-SECURITY"
        ],
        "responsibleRole": "IT and security",
        "basis": [
          {
            "kind": "technical_verification",
            "evidenceIds": [